|Y_article|_coordinates|_sent|a_head_form|a_head_number|a_head_pos|a_hypernyms|a_non_article_det|a_parent|a_pos_after_head|a_pos_before_head|a_referent|a_words_after_head|a_words_after_np|a_words_before_head|a_words_before_np|b_head_pos_simple|b_head_proper|b_is_postmodified|b_non_article_det_extended|b_postmodification_length|b_postmodification_pp_of|b_postmodification_type|b_postmodification_type_specific|b_predicate_form|b_referent|b_relative_position|Y_PREDICTED|Y_TRUE
6008|THE|"data/parsed/22/wsj_2240.mrg|1|90"|BMA Corp. , Kansas City , Mo. , said it 's weighing `` strategic alternatives , '' for its Business Men 's Assurance Co. unit , and is contacting possible buyers of [ the life and health insurance operation . ]|operation|sg|NN|[u'action.n.02']||PP|['.']|['NN', 'CC', 'NN', 'NN']|False|['.']|[]|['life', 'and', 'health', 'insurance']|[u'buyer', 'of']|NN|False|False|False|0|False|||'s|False|0.969696969697|ZERO|THE
6019|THE|"data/parsed/22/wsj_2240.mrg|3|6"|[ The Business Men 's ] Assurance unit represented about $ 288 million of the company 's $ 488 million in 1988 revenue , and the unit 's operating income was about $ 10 million , said S the spokesman .|Men|sg|NNP|[u'force.n.04']||NPB|['POS']|['NNP']|True|"[""'s""]"|['Assurance', 'unit']|['Business']|[]|NN|True|False|False|0|False|||represented||0.0|ZERO|THE
6022|THE|"data/parsed/22/wsj_2240.mrg|3|37"|The Business Men 's Assurance unit represented about $ 288 million of [ the company 's ] $ 488 million in 1988 revenue , and the unit 's operating income was about $ 10 million , said S the spokesman .|company|sg|NN|[u'institution.n.01']||NPB|['POS']|[]|False|"[""'s""]"|['$', '<number>']|[]|['million', 'of']|NN|False|False|False|0|False|||represented|False|0.324324324324|ZERO|THE
6044|THE|"data/parsed/22/wsj_2241.mrg|2|55"|A spokesman for Laidlaw declined to disclose the price the Toronto transportation and waste services concern paid for [ the additional shares , ] which he said were acquired `` over the last couple of weeks . ''|share|pl|NN|[u'assets.n.01']||NP|[',']|['JJ']|False|[',']|['which', 'he']|['additional']|[u'pay', 'for']|NN|False|True|False|14|False|SBAR|which|to|False|0.545454545455|ZERO|THE
6106|THE|"data/parsed/22/wsj_2242.mrg|6|44"|Export sales for leisure items alone , for instance , totaled 184.74 billion yen in [ the 12 months , ] up from 106.06 billion in the previous fiscal year .|month|pl|NN|[u'time_period.n.01']||PP|[',']|['CD']|False|[',']|['up', 'from']|['<number>']|['yen', 'in']|NN|False|False|False|0|False|||totaled|False|0.576923076923|ZERO|THE
6137|THE|"data/parsed/22/wsj_2243.mrg|5|3"|[ The closely held Hertz Corp. ] had annual revenue of close to $ 2 billion in 1988 , of which $ 1.7 billion was contributed by its Hertz Rent A Car operations world-wide .|Corp.|sg|NNP|||S|[]|['RB', 'VBN', 'NNP']|True|[]|[u'have', 'annual']|['closely', u'hold', 'Hertz']|[]|NN|True|False|False|0|False|||had||0.0|ZERO|THE
6149|THE|"data/parsed/22/wsj_2243.mrg|6|49"|Hertz Equipment is a major supplier of rental equipment in the U.S. , France , Spain and [ the U.K . ]|U.K|sg|NNP|||NP|['.']|[]|False|['.']|[]|[]|['Spain', 'and']|NN|True|False|False|0|False|||is||0.944444444444|ZERO|THE
6216|THE|"data/parsed/22/wsj_2245.mrg|3|64"|He said the third-quarter estimate indicates profit for the nine months of $ 4.65 a share , `` almost equal to [ the full-year 1988 earnings '' ] of $ 108.6 million , or $ 4.81 a share .|earnings|pl|NN|[u'income.n.01']||NP|"[""''""]"|['JJ', 'CD']|False|"[""''""]"|['of', '$']|['full-year', '<number>']|['equal', 'to']|NN|False|True|False|11|True|PP|of|indicates|False|0.636363636364|ZERO|THE
6227|THE|"data/parsed/22/wsj_2245.mrg|5|13"|Mr. Simmons said [ the third-quarter results ] reflect continued improvements in productivity and operating margins .|result|pl|NN|[u'phenomenon.n.01']||S|[]|['JJ']|False|[]|['reflect', 'continued']|['third-quarter']|['Simmons', u'say']|NN|False|False|False|0|False|||reflect|False|0.230769230769|ZERO|THE
6262|THE|"data/parsed/22/wsj_2246.mrg|4|10"|Both of [ the New York-based companies ] print stock certificates and currency .|company|pl|NN|[u'institution.n.01']||PP|[]|['NNP', 'JJ']|False|[]|['print', 'stock']|['New', 'York-based']|['Both', 'of']|NN|False|False|False|0|False|||print|False|0.222222222222|ZERO|THE
6281|THE|"data/parsed/22/wsj_2246.mrg|9|18"|Closely held U.S. Banknote offered [ the $ 7 ] a share , or $ 126 million , for as many as 14.9 million shares , or 78.6 % , of International Banknote 's shares outstanding .|$||QP|||NP|[]|[]|False|[]|['share']|[]|['Banknote', u'offer']|QP|False|True|False|3|False|NPB|a|offered||0.151515151515|ZERO|THE
6292|THE|"data/parsed/22/wsj_2246.mrg|10|54"|U.S. Banknote said that as of Oct. 13 , 16.1 million shares , or about 84.3 % of [ the fully diluted shares ] outstanding , had been tendered .|share|pl|NN|[u'assets.n.01']||NP|[]|['RB', 'JJ']|True|[]|['outstanding', ',']|['fully', 'diluted']|['%', 'of']|NN|False|True|False|2|False|ADJP|outstanding|had|True|0.72|ZERO|THE
6367|THE|"data/parsed/22/wsj_2248.mrg|4|39"|In a related move , Enron said it increased the number of [ the partnership 's ] units it will offer to 6,930,000 from 5,500,000 .|partnership|sg|NN|[u'business.n.01']||NPB|['POS']|[]|True|"[""'s""]"|[u'unit', 'it']|[]|['number', 'of']|NN|False|False|False|0|False|||increased|True|0.545454545455|ZERO|THE
6377|THE|"data/parsed/22/wsj_2248.mrg|6|59"|Enron said each unit will be priced in the $ 19-to-$21 range and will represent about 80 % of [ the partnership equity . ]|equity|sg|NN|[u'assets.n.01']||PP|['.']|['NN']|False|['.']|[]|['partnership']|['%', 'of']|NN|False|False|False|0|False|||will|False|0.95|ZERO|THE
6393|THE|"data/parsed/22/wsj_2249.mrg|2|13"|DIG Acquisition Corp. , [ the New Jersey investor 's acquisition vehicle , ] said that as of the close of business yesterday , 560,839 shares had been tendered .|vehicle|sg|NN|[u'conveyance.n.03']||NP|[',']|['NNP', 'NNP', 'NN', 'POS', 'NN']|False|[',']|[u'say', 'that']|"['New', 'Jersey', 'investor', ""'s"", 'acquisition']"|['Corp.', ',']|NN|False|False|False|0|False|||said|False|0.190476190476|ZERO|THE
6411|THE|"data/parsed/22/wsj_2249.mrg|5|3"|[ The new expiration date ] is the date on which DIG 's financing commitments , which total about $ 240 million , are to expire .|date|sg|NN|[u'day.n.01']||S|[]|['JJ', 'NN']|False|[]|[u'be']|['new', 'expiration']|[]|NN|False|False|False|0|False|||is|False|0.0|ZERO|THE
6412|THE|"data/parsed/22/wsj_2249.mrg|5|15"|The new expiration date is [ the date ] on which DIG 's financing commitments , which total about $ 240 million , are to expire .|date|sg|NN|[u'day.n.01']||VP|[]|[]|False|[]|['on', 'which']|[]|['date', u'be']|NN|False|False|False|0|False|||is|True|0.208333333333|ZERO|THE
6442|THE|"data/parsed/22/wsj_2250.mrg|4|20"|After years of fading into [ the background , ] two-tone photography is coming back .|background|sg|NN|[u'inheritance.n.04']||PP|[',']|[]|False|[',']|['two-tone', 'photography']|[]|[u'fade', 'into']|NN|False|False|False|0|False|||fading|False|0.416666666667|ZERO|THE
6495|THE|"data/parsed/22/wsj_2250.mrg|15|65"|At Kodak , which largely ignored the market for years , black-and-white film sales now account for nearly 15 % of [ the company 's ] $ 3 billion in film and paper sales annually , up from 10 % three years ago .|company|sg|NN|[u'institution.n.01']||NP|['POS']|[]|True|"[""'s""]"|['$', '<number>']|[]|['%', 'of']|NN|False|True|False|10|False|NP|$|account|True|0.525|ZERO|THE
6503|THE|"data/parsed/22/wsj_2250.mrg|16|44"|The Rochester , N.Y. , photographic giant recently began marketing T-Max 3200 , one of [ the fastest and most sensitive monochrome films . ]|film|pl|NN|[u'product.n.02', u'show.n.03']||PP|['.']|['JJS', 'CC', 'JJS', 'JJ', 'JJ']|True|['.']|[]|[u'fast', 'and', 'most', 'sensitive', 'monochrome']|['one', 'of']|NN|False|False|False|0|False|||marketing|True|0.9375|ZERO|THE
6531|THE|"data/parsed/22/wsj_2250.mrg|21|14"|The biggest beneficiary of [ the black-and-white revival ] is likely to be International Paper Co. 's Ilford division , known in the industry for its premium products .|revival|sg|NN|[u'improvement.n.01']||PP|[]|['JJ']|False|[]|[u'be', 'likely']|['black-and-white']|['beneficiary', 'of']|NN|False|False|False|0|False|||is|False|0.16|ZERO|THE
6558|THE|"data/parsed/22/wsj_2250.mrg|26|50"|`` It has an archival , almost nostalgic quality to it , '' says Owen B. Butler , [ the chairman ] of the applied photography department at Rochester Institute of Technology .|chairman|sg|NN|[u'presiding_officer.n.01']||NP|[]|[]|False|[]|['of']|[]|['Butler', ',']|NN|False|True|False|11|True|PP|of||False|0.6|ZERO|THE
6584|THE|"data/parsed/22/wsj_2250.mrg|31|12"|Richard Crisman , [ the account manager ] for the campaign , says Gap did n't intentionally choose black and white to distinguish its ads from the color spreads of competitors .|manager|sg|NN|[u'administrator.n.01']||NP|[]|['NN']|False|[]|['for']|['account']|['Crisman', ',']|NN|False|True|False|4|False|PP|for|says|False|0.107142857143|ZERO|THE
6588|THE|"data/parsed/22/wsj_2250.mrg|31|71"|Richard Crisman , the account manager for the campaign , says Gap did n't intentionally choose black and white to distinguish its ads from [ the color spreads ] of competitors .|spread|pl|NN|[u'change_of_location.n.01']||NP|[]|['NN']|False|[]|['of', u'competitor']|['color']|[u'ad', 'from']|NN|False|True|False|3|True|PP|of|to|False|0.857142857143|ZERO|THE
6629|THE|"data/parsed/22/wsj_2250.mrg|39|70"|His On-Broadway Photography studio in Portland , Ore. , doubled its business last year and , he says S , is booked solid for [ the next five . ]|five||CD|[u'digit.n.01']||PP|['.']|['JJ']|False|['.']|[]|['next']|['solid', 'for']|CD|False|False|False|0|False|||is||0.96|ZERO|THE
6781|THE|"data/parsed/22/wsj_2251.mrg|6|10"|McClatchy publishes [ the Sacramento -LRB- Calif . -RRB- Bee ] and Tacoma -LRB- Wash . -RRB- News Tribune , and other papers in Western states .|Bee|sg|NNP|[u'hymenopterous_insect.n.01']||NP|[]|['NNP', '-LRB-', 'NNP', '.', '-RRB-']|False|[]|['and', 'Tacoma']|['Sacramento', '-LRB-', 'Calif', '.', '-RRB-']|['McClatchy', u'publish']|NN|True|True|False|1|False|CC|and|publishes||0.105263157895|ZERO|THE
6810|THE|"data/parsed/22/wsj_2252.mrg|4|35"|Those two offers were private and the spokesman refused to identify [ the bidding companies . ]|company|pl|NN|[u'institution.n.01']||VP|['.']|['NN']|True|['.']|[]|['bidding']|['to', 'identify']|NN|False|False|False|0|False|||to|True|0.916666666667|ZERO|THE
6843|THE|"data/parsed/22/wsj_2253.mrg|2|94"|The barometer , developed by analysts at Columbia University 's Center for International Business Cycle Research here , reached a record high of 223.0 in August , the latest month available , and [ the Columbia researchers ] estimate that it has moved even higher since then .|researcher|pl|NN|[u'scientist.n.01']||S|[]|['NNP']|False|[]|['estimate', 'that']|['Columbia']|[',', 'and']|NN|False|False|False|0|False|||estimate|False|0.75|ZERO|THE
6884|THE|"data/parsed/22/wsj_2253.mrg|8|44"|A leading authority on the business cycle , Mr. Moore also is a member of [ the Business Cycle Dating Group , ] the panel of private economists that decides for the government when expansions and recessions begin and end .|Group|sg|NNP|[u'abstraction.n.06']||NP|[',']|['NNP', 'NNP', 'NNP']|False|[',']|['panel']|['Business', 'Cycle', 'Dating']|['member', 'of']|NN|True|True|False|18|False|NP|the|is||0.441176470588|ZERO|THE
6896|THE|"data/parsed/22/wsj_2253.mrg|10|45"|`` No meeting is scheduled because the expansion shows no sign of going off [ the tracks , '' ] Mr. Moore reports .|track|pl|NN|[u'line.n.11']||VP|"[',', ""''""]"|[]|False|"[',', ""''""]"|['Mr.', 'Moore']|[]|[u'go', 'off']|NN|False|False|False|0|False|||going|False|0.736842105263|ZERO|THE
6901|THE|"data/parsed/22/wsj_2253.mrg|11|45"|Based largely on the recent strength in their index , called the long leading indicator , [ the Columbia analysts ] foresee uninterrupted economic growth through the rest of this year and next year as well .|analyst|pl|NN|[u'expert.n.01']||S|[]|['NNP']|False|[]|['foresee', 'uninterrupted']|['Columbia']|['indicator', ',']|NN|False|False|False|0|False|||foresee|False|0.484848484848|ZERO|THE
6909|THE|"data/parsed/22/wsj_2253.mrg|12|29"|They expect a 2.6 % rise in 1990 in [ the gross national product , ] after adjustment for inflation .|product|sg|NN|[u'commodity.n.01']||PP|[',']|['JJ', 'JJ']|False|[',']|['after', 'adjustment']|['gross', 'national']|['<number>', 'in']|NN|False|False|False|0|False|||expect|False|0.6|ZERO|THE
6930|THE|"data/parsed/22/wsj_2253.mrg|15|4"|[ The comparable lead times ] for the Commerce index , whose components include the stock market , are far shorter -- 10 months before recessions and only three months before recoveries .|time|pl|NN|[u'time_period.n.01']||NP|[]|['JJ', 'JJ']|False|[]|['for']|['comparable', 'lead']|[]|NN|False|True|False|12|False|PP|for|are|False|0.0|ZERO|THE
6937|THE|"data/parsed/22/wsj_2253.mrg|16|3"|[ The Columbia economists ] also have reconstructed how the long leading index would have behaved , had it existed , in 1929 , before the stock market crash in October that ushered in the Great Depression .|economist|pl|NN|[u'social_scientist.n.01']||S|[]|['NNP']|False|[]|['also', 'have']|['Columbia']|[]|NN|False|False|False|0|False|||have|False|0.0|ZERO|THE
6954|THE|"data/parsed/22/wsj_2253.mrg|19|15"|A major source of [ the recent strength ] in the long leading indicator has been the performance of the Dow Jones corporate bond-price index , which is not a part of the Commerce index .|strength|sg|NN|[u'property.n.02']||NP|[]|['JJ']|False|[]|['in']|['recent']|['source', 'of']|NN|False|True|False|5|False|PP|in|has|False|0.125|ZERO|THE
6976|THE|"data/parsed/22/wsj_2253.mrg|22|92"|Other components of the long leading indicator include a ratio of prices to unit labor costs in manufacturing industries , the M2 version of the money supply , adjusted for inflation , and [ the volume ] of new home-building permits .|volume|sg|NN|[u'measure.n.02']||NP|[]|[]|False|[]|['of', 'new']|[]|[',', 'and']|NN|False|True|False|5|True|PP|of|include|False|0.846153846154|ZERO|THE
6979|THE|"data/parsed/22/wsj_2253.mrg|23|12"|Notably absent from [ the Columbia ] index is the stock market , which Mr. Moore says `` is simply no longer such a good indicator of the economy 's long-range prospects , though it still is useful for anticipating some short-run twists and turns . ''|Columbia|sg|NNP|[]||PP|[]|[]|False|[]|['index', u'be']|[]|['absent', 'from']|NN|True|False|False|0|False|||is||0.0681818181818|ZERO|THE
6990|THE|"data/parsed/22/wsj_2253.mrg|24|39"|As recently as 1975 , the stock market -- as reflected in [ the Standard & Poor 's ] index of 500 common stocks -- was rated by the National Bureau of Economic Research as the best of the 12 leading indicators that then made up the Commerce index .|Poor|sg|NNP|[u'people.n.01']||NPB|['POS']|['NNP', 'CC']|False|"[""'s""]"|['index', 'of']|['Standard', '&']|[u'reflect', 'in']|NN|True|False|False|0|False|||reflected||0.272727272727|ZERO|THE
7003|THE|"data/parsed/22/wsj_2253.mrg|25|68"|It was assigned a mark of 80 out of a possible 100 , compared with scores ranging as low as 69 for [ the other components . ]|component|pl|NN|[u'part.n.09']||PP|['.']|['JJ']|True|['.']|[]|['other']|['<number>', 'for']|NN|False|False|False|0|False|||was|True|0.95652173913|ZERO|THE
7018|THE|"data/parsed/22/wsj_2253.mrg|27|91"|`` Stocks have become more sensitive to factors not directly tied to the domestic economy , '' Mr. Moore says , citing the exchange rate for the dollar on currency markets , [ the foreign-trade balance and inflows ] of foreign capital .|inflow|pl|NN|[u'flow.n.04']||NP|[]|['JJ', 'NN', 'CC']|False|[]|['of', 'foreign']|['foreign-trade', 'balance', 'and']|[u'market', ',']|NN|False|True|False|4|True|PP|of|citing|False|0.864864864865|ZERO|THE
7117|THE|"data/parsed/22/wsj_2255.mrg|6|17"|The rating agency also reduced [ the ratings ] for long-term deposits to B-3 from Ba-3 and for preferred stock to Ca from Caa .|rating|pl|NN|[u'appraisal.n.01']||NP|[]|[]|True|[]|['for', 'long-term']|[]|['also', u'reduce']|NN|False|True|False|3|False|PP|for|reduced|True|0.227272727273|ZERO|THE
7125|THE|"data/parsed/22/wsj_2255.mrg|8|4"|[ The downgrades ] were prompted , Moody 's said S , by the continuing turmoil in the junk bond market and the suspension of dividends on CenTrust 's preferred stock .|downgrade|pl|NN|[u'grade.n.03']||S|[]|[]|True|[]|[u'be', u'prompt']|[]|[]|NN|False|False|False|0|False|||were|True|0.0|ZERO|THE
7128|THE|"data/parsed/22/wsj_2255.mrg|8|34"|The downgrades were prompted , Moody 's said S , by [ the continuing turmoil ] in the junk bond market and the suspension of dividends on CenTrust 's preferred stock .|turmoil|sg|NN|[u'disturbance.n.03']||NP|[]|['VBG']|False|[]|['in']|[u'continue']|[',', 'by']|NN|False|True|False|16|False|PP|in|said|False|0.392857142857|ZERO|THE
7141|THE|"data/parsed/22/wsj_2256.mrg|1|3"|[ THE STOCK MARKET ] AVOIDED a repeat of Black Monday as prices recovered from an early slide , spurred by bargain-hunting institutions and program traders .|MARKET|sg|NNP|[u'activity.n.01']||S|[]|['NNP']|False|[]|['AVOIDED']|['STOCK']|[]|NN|True|False|False|0|False|||AVOIDED||0.0|ZERO|THE
7153|THE|"data/parsed/22/wsj_2256.mrg|2|72"|The Dow Jones industrials closed up 88.12 points , at 2657.38 , the fourth-biggest gain ever , after being down as much as 63.52 points in [ the morning . ]|morning|sg|NN|[u'time_period.n.01']||PP|['.']|[]|False|['.']|[]|[]|[u'point', 'in']|NN|False|False|False|0|False|||being|False|0.962962962963|ZERO|THE
7213|THE|"data/parsed/22/wsj_2256.mrg|17|62"|U.S. auto makers plan to decrease car production 10.4 % in the fourth quarter , with virtually all the decline coming from [ the Big Three . ]|Big|sg|NNP|||PP|['CD', '.']|[]|False|['Three', '.']|[]|[]|[u'come', 'from']|NN|True|False|False|0|False|||coming||0.95652173913|ZERO|THE
7259|THE|"data/parsed/22/wsj_2256.mrg|28|29"|Blue Arrow of Britain plans to return to [ the name Manpower ] and take a big write-off .|Manpower|sg|NNP|[u'force.n.04']||PP|[]|['NN']|False|[]|['and', 'take']|['name']|['return', 'to']|NN|True|False|False|0|False|||to||0.533333333333|ZERO|THE
7261|THE|"data/parsed/22/wsj_2256.mrg|29|3"|[ The moves ] may help the firm solidify its dominance of the U.S. temporary-help market .|move|pl|NN|[u'decision.n.01']||S|[]|[]|False|[]|['may', 'help']|[]|[]|NN|False|False|False|0|False|||may|False|0.0|ZERO|THE
7276|THE|"data/parsed/22/wsj_2256.mrg|32|51"|K mart agreed to acquire Pace Membership Warehouse for $ 322 million , expanding its presence in [ the growing wholesale-store business . ]|business|sg|NN|[u'enterprise.n.02']||PP|['.']|['VBG', 'NN']|False|['.']|[]|[u'grow', 'wholesale-store']|['presence', 'in']|NN|False|False|False|0|False|||expanding|False|0.944444444444|ZERO|THE
7306|THE|"data/parsed/22/wsj_2257.mrg|2|4"|[ The key U.S. and foreign annual interest rates ] below are a guide to general levels but do n't always represent actual transactions .|rate|pl|NN|[u'tax.n.01']||NP|[]|['JJ', 'NNP', 'CC', 'JJ', 'JJ', 'NN']|False|[]|['below', u'be']|['key', 'U.S.', 'and', 'foreign', 'annual', 'interest']|[]|NN|False|True|False|1|False|ADVP|below|are|False|0.0|ZERO|THE
7521|THE|"data/parsed/22/wsj_2258.mrg|3|31"|Intel , based in Santa Clara , Calif. , is [ the market leader ] for traditional microprocessors with its 8086 family that forms the heart of IBM-compatible personal computers .|leader|sg|NN|[u'person.n.01']||VP|[]|['NN']|False|[]|['for', 'traditional']|['market']|[',', u'be']|NN|False|False|False|0|False|||is|False|0.37037037037|ZERO|THE
7553|THE|"data/parsed/22/wsj_2259.mrg|1|35"|Omnicare Inc. , which intends to expand its position in [ the medical and dental markets , ] said it acquired a cotton and gauze products division from closely held Sterile Products Corp. for $ 8.2 million .|market|pl|NN|[u'activity.n.01']||PP|[',']|['JJ', 'CC', 'JJ']|False|[',']|[u'say', 'it']|['medical', 'and', 'dental']|['position', 'in']|NN|False|False|False|0|False|||to|False|0.322580645161|ZERO|THE
7576|THE|"data/parsed/22/wsj_2259.mrg|4|39"|Omnicare said the division operates under the trade name ACCO and supplies [ the medical and dental markets . ]|market|pl|NN|[u'activity.n.01']||VP|['.']|['JJ', 'CC', 'JJ']|True|['.']|[]|['medical', 'and', 'dental']|['and', u'supply']|NN|False|False|False|0|False|||operates|True|0.923076923077|ZERO|THE
7653|THE|"data/parsed/22/wsj_2261.mrg|5|19"|The company 's remaining business is [ the manufacture ] and sale of engine and transmissions products for industrial and transportation applications .|manufacture|sg|NN|[u'commercial_enterprise.n.02']||NP|[]|[]|False|[]|['and', 'sale']|[]|['business', u'be']|NN|False|True|False|1|False|CC|and|is|False|0.3|ZERO|THE
7748|THE|"data/parsed/22/wsj_2264.mrg|2|10"|This is [ the place ] that world opinion has been celebrating over in the expectation that it 's going to hold an election .|place|sg|NN|[u'point.n.02']||NP|[]|[]|False|[]|['that', 'world']|[]|['This', u'be']|NN|False|True|False|19|False|SBAR|that|is|False|0.0909090909091|ZERO|THE
7757|THE|"data/parsed/22/wsj_2264.mrg|4|31"|The U.S. journalist 's `` crime '' was writing that [ the head ] of the commission charged with overseeing the election 's fairness , Bryan O'Linn , was openly sympathetic to SWAPO .|head|sg|NN|[u'external_body_part.n.01']||NP|[]|[]|False|[]|['of']|[]|[u'write', 'that']|NN|False|True|False|11|True|PP|of|was|False|0.322580645161|ZERO|THE
7795|THE|"data/parsed/22/wsj_2264.mrg|8|85"|To the extent Mr. Stanley has done anything wrong , it may be that he is out of step with the consensus of world intellectuals that [ the Namibian guerrillas ] were above all else the victims of suppression by neighboring South Africa .|guerrilla|pl|NN|[u'warrior.n.01']||S|[]|['JJ']|False|[]|[u'be', 'above']|['Namibian']|[u'intellectual', 'that']|NN|False|False|False|0|False|||were|False|0.65|ZERO|THE
7802|THE|"data/parsed/22/wsj_2264.mrg|9|27"|SWAPO has enjoyed favorable Western media treatment ever since [ the U.N. General Assembly ] declared it the `` sole , authentic representative '' of Namibia 's people in|Assembly|sg|NNP|[u'machine.n.01']||S|[]|['NNP', 'NNP']|False|[]|[u'declare', 'it']|['U.N.', 'General']|['ever', 'since']|NN|True|False|False|0|False|||declared||0.375|ZERO|THE
7843|THE|"data/parsed/22/wsj_2264.mrg|15|24"|Mr. Stanley was arrested and charged along with [ the others ] when he returned to Namibia this month .|others|pl|NN|||PP|[]|[]|False|[]|['when', 'he']|[]|['along', 'with']|NN|False|False|False|0|False|||was|False|0.470588235294|ZERO|THE
7848|THE|"data/parsed/22/wsj_2264.mrg|16|15"|Both the State Department and [ the Lawyers Committee for Freedom of the Press ] have protested Mr. Stanley 's detention .|NNP||NX|||NP|[]|[]|False|[]|['have', u'protest']|[]|['Department', 'and']|NX|False|False|False|0|False|||have|False|0.384615384615|ZERO|THE
7849|THE|"data/parsed/22/wsj_2264.mrg|16|31"|Both the State Department and the Lawyers Committee for Freedom of [ the Press ] have protested Mr. Stanley 's detention .|Press|sg|NNP|[u'urgency.n.01']||PP|[]|[]|True|[]|['have', u'protest']|[]|['Freedom', 'of']|NN|True|False|False|0|False|||have||0.578947368421|ZERO|THE
7866|THE|"data/parsed/22/wsj_2264.mrg|19|49"|The U.S. is in the habit of arranging peace settlements and then washing its hands over [ the tragic results . ]|result|pl|NN|[u'phenomenon.n.01']||PP|['.']|['JJ']|False|['.']|[]|['tragic']|[u'hand', 'over']|NN|False|False|False|0|False|||arranging|False|0.941176470588|ZERO|THE
7876|THE|"data/parsed/22/wsj_2264.mrg|21|55"|State and the human-rights community should insist that Mr. Stanley and his fellow defendants be released and that [ the United Nation 's ] monitors make certain that Mr. O'Linn's commission investigates election complaints from all sides .|Nation|sg|NNP|[u'political_unit.n.01']||NPB|['POS']|['NNP']|False|"[""'s""]"|[u'monitor', 'make']|['United']|['and', 'that']|NN|True|False|False|0|False|||make||0.545454545455|ZERO|THE
7942|THE|"data/parsed/22/wsj_2265.mrg|13|3"|[ The spot October gold price ] rose $ 4 to $ 367.30 an ounce .|price|sg|NN|[u'value.n.02']||S|[]|['JJ', 'NNP', 'NN']|True|[]|[u'rise', '$']|['spot', 'October', 'gold']|[]|NN|False|False|False|0|False|||rose|True|0.0|ZERO|THE
7946|THE|"data/parsed/22/wsj_2265.mrg|14|3"|[ The more active December delivery gold ] settled with a gain of $ 3.90 an ounce at $ 371.20 , after trading as high as $ 374 .|gold|sg|NN|[u'precious_metal.n.01']||S|[]|['RBR', 'JJ', 'NNP', 'NN']|True|[]|[u'settle', 'with']|['more', 'active', 'December', 'delivery']|[]|NN|False|False|False|0|False|||settled|True|0.0|ZERO|THE
7983|THE|"data/parsed/22/wsj_2265.mrg|20|55"|The October 1987 contract that day rose as much as $ 8.70 to as high as $ 471.60 , and [ the more deferred positions , ] due to mature as late as March 1989 , rose as much as $ 9.60 .|position|pl|NN|[u'point.n.02']||NP|[',']|['RBR', 'JJ']|False|[',']|['due', 'to']|['more', 'deferred']|[',', 'and']|NN|False|True|False|9|False|ADJP|due|rose|False|0.540540540541|ZERO|THE
7995|THE|"data/parsed/22/wsj_2265.mrg|21|98"|On Black Monday , Oct. 19 , 1987 , the October contract tacked on further gains , rising to as high as $ 491.50 for a gain of almost $ 20 on top of [ the Friday ] advances , before giving up almost $ 10 of that at the close .|Friday|sg|NNP|[u'weekday.n.01']||PP|[]|[]|True|[]|[u'advance', ',']|[]|['top', 'of']|NN|True|False|False|0|False|||rising||0.69387755102|ZERO|THE
8066|THE|"data/parsed/22/wsj_2265.mrg|33|48"|But most market observers agreed that Friday 's stock market drop is what dampened spirits in [ the petroleum pits ] yesterday .|pit|pl|NN|[u'hole.n.05']||PP|[]|['NN']|False|[]|['yesterday', '.']|['petroleum']|[u'spirit', 'in']|NN|False|False|False|0|False|||dampened|False|0.842105263158|ZERO|THE
