|Y_article|_coordinates|_sent|a_head_form|a_head_number|a_head_pos|a_hypernyms|a_non_article_det|a_parent|a_pos_after_head|a_pos_before_head|a_referent|a_words_after_head|a_words_after_np|a_words_before_head|a_words_before_np|b_head_pos_simple|b_head_proper|b_is_postmodified|b_non_article_det_extended|b_postmodification_length|b_postmodification_pp_of|b_postmodification_type|b_postmodification_type_specific|b_predicate_form|b_referent|b_relative_position|Y_PREDICTED|Y_TRUE
4653|THE|"data/parsed/22/wsj_2232.mrg|18|13"|But most of [ the 30 blue-chip stocks ] in the average , including Eastman Kodak and General Motors , could n't trade because of the heavy backlog of sell orders left over from Friday 's late-afternoon rout .|stock|pl|NN|[u'framework.n.03']||NP|[]|['CD', 'JJ']|False|[]|['in']|['<number>', 'blue-chip']|['most', 'of']|NN|False|True|False|4|False|PP|in|could|False|0.0882352941176|ZERO|THE
4667|THE|"data/parsed/22/wsj_2232.mrg|20|4"|[ The Dow ] dropped to a quick 27-point loss , and to many traders it looked as if stocks were headed for yet another big tumble .|Dow|sg|NNP|||S|[]|[]|True|[]|[u'drop', 'to']|[]|[]|NN|True|False|False|0|False|||dropped||0.0|ZERO|THE
4675|THE|"data/parsed/22/wsj_2232.mrg|21|29"|More stocks opened over the ensuing half hour , as [ the 49 Big Board specialist firms ] in charge of keeping the market orderly groped to find buy orders from major brokerage firms to match the selling flood .|firm|pl|NN|[u'business.n.01']||NP|[]|['CD', 'NNP', 'NNP', 'NN']|False|[]|['in', 'charge']|['<number>', 'Big', 'Board', 'specialist']|[',', 'as']|NN|False|True|False|22|False|PP|in|opened|False|0.30303030303|ZERO|THE
4677|THE|"data/parsed/22/wsj_2232.mrg|21|57"|More stocks opened over the ensuing half hour , as the 49 Big Board specialist firms in charge of keeping [ the market orderly groped ] to find buy orders from major brokerage firms to match the selling flood .|groped|pl|NN|||S|[]|['NN', 'JJ']|False|[]|['to', 'find']|['market', 'orderly']|['of', u'keep']|NN|False|False|False|0|False|||to|False|0.571428571429|ZERO|THE
4691|THE|"data/parsed/22/wsj_2232.mrg|23|62"|There was heavy stock-index arbitrage , as traders sold big baskets of stock and bought stock-index futures to profit from [ the price discrepancies ] between the two markets .|discrepancy|pl|NN|[u'difference.n.01']||NP|[]|['NN']|False|[]|['between']|['price']|['profit', 'from']|NN|False|True|False|5|False|PP|between|to|False|0.769230769231|ZERO|THE
4701|THE|"data/parsed/22/wsj_2232.mrg|25|12"|The onslaught of [ the program selling ] dashed any hopes that some of the big program trading firms would hold off until the market stabilized .|selling|sg|NN|[u'commerce.n.01']||PP|[]|['NN']|True|[]|[u'dash', 'any']|['program']|['onslaught', 'of']|NN|False|False|False|0|False|||dashed|True|0.130434782609|ZERO|THE
4707|THE|"data/parsed/22/wsj_2232.mrg|27|3"|[ The Dow ] accelerated its slide , losing 63.52 in the first 40 minutes of trading .|Dow|sg|NNP|||S|[]|[]|False|[]|[u'accelerate', 'its']|[]|[]|NN|True|False|False|0|False|||accelerated||0.0|ZERO|THE
4717|THE|"data/parsed/22/wsj_2232.mrg|29|12"|Then at 10:15 [ the Dow ] suddenly started to rebound , and when it shot upward it did so even faster than the early-morning fall .|Dow|sg|NNP|||S|[]|[]|True|[]|['suddenly', u'start']|[]|['at', '10:15']|NN|True|False|False|0|False|||started||0.125|ZERO|THE
4723|THE|"data/parsed/22/wsj_2232.mrg|30|24"|And this time , it was n't just [ the program traders ] who were responsible .|trader|pl|NN|[u'merchant.n.01']||NP|[]|['NN']|True|[]|['who', u'be']|['program']|"[""n't"", 'just']"|NN|False|True|False|4|False|SBAR|who|was|True|0.615384615385|ZERO|THE
4730|THE|"data/parsed/22/wsj_2232.mrg|32|3"|[ The program traders ] were in there , too , of course .|trader|pl|NN|[u'merchant.n.01']||S|[]|['NN']|True|[]|[u'be', 'in']|['program']|[]|NN|False|False|False|0|False|||were|True|0.0|ZERO|THE
4734|THE|"data/parsed/22/wsj_2232.mrg|33|18"|But according to one trader , [ the programmers `` ] did n't look as dominant on the upside as on the downside because there was -LCB- also -RCB- a lot of bargain-hunting '' by institutions .|programmer|pl|NN|[u'computer_user.n.01', u'engineer.n.01']||S|['``']|[]|False|['``']|"[u'do', ""n't""]"|[]|['trader', ',']|NN|False|False|False|0|False|||did|False|0.181818181818|ZERO|THE
4736|THE|"data/parsed/22/wsj_2232.mrg|33|52"|But according to one trader , the programmers `` did n't look as dominant on the upside as on [ the downside ] because there was -LCB- also -RCB- a lot of bargain-hunting '' by institutions .|downside|sg|NN|[u'side.n.06']||PP|[]|[]|False|[]|['because', 'there']|[]|['as', 'on']|NN|False|False|False|0|False|||did|False|0.558823529412|ZERO|THE
4768|THE|"data/parsed/22/wsj_2232.mrg|37|65"|According to Big Board officials , Disney had one of the biggest sell-order imbalances on Friday ; it was one of [ the seven stocks ] that could n't finish trading that day .|stock|pl|NN|[u'framework.n.03']||NP|[]|['CD']|False|[]|['that', 'could']|['seven']|['one', 'of']|NN|False|True|False|8|False|SBAR|that|was|False|0.7|ZERO|THE
4782|THE|"data/parsed/22/wsj_2232.mrg|40|56"|However , Disney specialist Robert Fagenson said : `` I would be surprised if Goldman represented 4 % of [ the opening volume . '' ]|volume|sg|NN|[u'measure.n.02']||PP|"['.', ""''""]"|['NN']|False|"['.', ""''""]"|[]|['opening']|['%', 'of']|NN|False|False|False|0|False|||represented|False|0.95|ZERO|THE
4810|THE|"data/parsed/22/wsj_2232.mrg|48|18"|But in another dramatic burst , [ the Dow ] tacked on 42 points in five minutes , and at 10:25 the index showed a gain of 5.74 .|Dow|sg|NNP|||S|[]|[]|False|[]|[u'tack', 'on']|[]|['burst', ',']|NN|True|False|False|0|False|||tacked||0.230769230769|ZERO|THE
4844|THE|"data/parsed/22/wsj_2232.mrg|53|18"|`` It was bedlam on [ the upside , '' ] said one Big Board specialist .|upside|sg|NN|[u'side.n.04']||PP|"[',', ""''""]"|[]|False|"[',', ""''""]"|[u'say', 'one']|[]|['bedlam', 'on']|NN|False|False|False|0|False|||was|False|0.416666666667|ZERO|THE
4852|THE|"data/parsed/22/wsj_2232.mrg|55|53"|The carnage on the Chicago Board Options Exchange , the nation 's major options market , was heavy after [ the trading ] in S&P 100 stock-index options was halted Friday .|trading|sg|NN|[u'commerce.n.01']||NP|[]|[]|False|[]|['in', 'S&P']|[]|['heavy', 'after']|NN|False|True|False|5|False|PP|in|was|False|0.655172413793|ZERO|THE
4864|THE|"data/parsed/22/wsj_2232.mrg|57|21"|Over the weekend , clearing firms told [ the Chicago market makers ] to get out of their positions at any cost Monday morning .|maker|pl|NN|[u'creator.n.02']||VP|[]|['NNP', 'NN']|True|[]|['to', 'get']|['Chicago', 'market']|[u'firm', u'tell']|NN|False|False|False|0|False|||told|True|0.35|ZERO|THE
4872|THE|"data/parsed/22/wsj_2232.mrg|59|45"|Some traders said that the closely watched Major Market Index , whose 20 stocks mimic [ the Dow industrials , ] did n't lead yesterday 's big rally .|industrials|pl|NN|||PP|[',']|['NNP']|False|[',']|"[u'do', ""n't""]"|['Dow']|[u'stock', 'mimic']|NN|False|False|False|0|False|||stocks|False|0.625|ZERO|THE
4924|THE|"data/parsed/22/wsj_2232.mrg|67|55"|But yesterday , even with halts in such major blue-chip stocks as Merck , `` we expected -LRB- [ the halts ] -RRB- and it was n't too bad , '' said S Donaldson 's Mr. Eppel , who had been critical of the specialists ' performance on Friday .|halt|pl|NN|[u'inaction.n.01']||PRN|[]|[]|False|[]|['-RRB-', 'and']|[]|[u'expect', '-LRB-']|NN|False|False|False|0|False|||expected|True|0.382978723404|ZERO|THE
4929|THE|"data/parsed/22/wsj_2232.mrg|67|119"|But yesterday , even with halts in such major blue-chip stocks as Merck , `` we expected -LRB- the halts -RRB- and it was n't too bad , '' said S Donaldson 's Mr. Eppel , who had been critical of [ the specialists ' ] performance on Friday .|specialist|pl|NN|[u'expert.n.01']||NPB|['POS']|[]|True|"[""'""]"|['performance', 'on']|[]|['critical', 'of']|NN|False|False|False|0|False|||had|True|0.891304347826|ZERO|THE
4967|THE|"data/parsed/22/wsj_2232.mrg|74|8"|Because of [ the UAL and AMR tumbles , ] airlines were the weakest sector of the market yesterday .|tumble|pl|NN|[u'acrobatic_stunt.n.01']||PP|[',']|['NNP', 'CC', 'NNP']|False|[',']|[u'airline', u'be']|['UAL', 'and', 'AMR']|['Because', 'of']|NN|False|False|False|0|False|||were|False|0.153846153846|ZERO|THE
5032|THE|"data/parsed/22/wsj_2232.mrg|82|66"|Mr. Phelan said that program trading strategies were n't responsible for triggering Friday 's decline despite a jump in the use of [ the computer-driven strategies ] in recent months .|strategy|pl|NN|[u'plan_of_action.n.01']||PP|[]|['JJ']|False|[]|['in', 'recent']|['computer-driven']|['use', 'of']|NN|False|False|False|0|False|||triggering|True|0.814814814815|ZERO|THE
5082|THE|"data/parsed/22/wsj_2232.mrg|88|76"|Meanwhile , Peter DaPuzzo , Shearson 's head of retail equity trading , praised institutional investors in the OTC market , who were heavy buyers of [ the Nasdaq 's ] biggest technology issues yesterday amid a flood of selling by other investors .|Nasdaq|sg|NNP|[]||NPB|['POS']|[]|False|"[""'s""]"|[u'big', 'technology']|[]|[u'buyer', 'of']|NN|True|False|False|0|False|||were||0.65|ZERO|THE
5087|THE|"data/parsed/22/wsj_2232.mrg|89|4"|[ `` The institutions ] ca n't be criticized for their behavior , '' Mr. DaPuzzo said in an interview .|institution|pl|NN|[u'organization.n.01']||S|[]|['``']|False|[]|"['ca', ""n't""]"|['``']|[]|NN|False|False|False|0|False|||ca|False|0.0|ZERO|THE
5117|THE|"data/parsed/22/wsj_2232.mrg|96|34"|`` They did an excellent job , '' Mr. Phelan said of [ the specialists . ]|specialist|pl|NN|[u'expert.n.01']||PP|['.']|[]|True|['.']|[]|[]|[u'say', 'of']|NN|False|False|False|0|False|||said|True|0.923076923077|ZERO|THE
5120|THE|"data/parsed/22/wsj_2232.mrg|97|26"|Wall Street traders on Friday had complained about [ the trading suspensions . ]|suspension|pl|NN|[u'mixture.n.01']||PP|['.']|['NN']|False|['.']|[]|['trading']|[u'complain', 'about']|NN|False|False|False|0|False|||had|False|0.888888888889|ZERO|THE
5132|THE|"data/parsed/22/wsj_2233.mrg|2|3"|[ The anti-defense Greens ] wanted a Washington federal appeals court to block today 's scheduled liftoff long enough for them to ask the World Court to `` order '' a permanent cancellation of the $ 1.5 billion flight .|Greens|sg|NNP|[u'vegetable.n.01']||S|[]|['JJ']|False|[]|[u'want']|['anti-defense']|[]|NN|True|False|False|0|False|||wanted||0.0|ZERO|THE
5139|THE|"data/parsed/22/wsj_2233.mrg|2|88"|The anti-defense Greens wanted a Washington federal appeals court to block today 's scheduled liftoff long enough for them to ask the World Court to `` order '' a permanent cancellation of [ the $ 1.5 billion flight . ]|flight|sg|NN|[u'formation.n.01']||PP|['.']|['$', 'CD', 'CD']|False|['.']|[]|['$', '<number>', 'billion']|['cancellation', 'of']|NN|False|False|False|0|False|||to|False|0.969696969697|ZERO|THE
5160|THE|"data/parsed/22/wsj_2234.mrg|2|3"|[ The restrictions ] would cover all but a small percentage of domestic air traffic , and represent a major expansion of the current smoking ban on flights of two hours or less .|restriction|pl|NN|[u'rule.n.01']||S|[]|[]|False|[]|['would', 'cover']|[]|[]|NN|False|False|False|0|False|||would|False|0.0|ZERO|THE
5187|THE|"data/parsed/22/wsj_2234.mrg|6|23"|As a practical matter , flights from [ the West Coast ] to Hawaii would be covered as they are under the time limit , but the language would exempt longer routes beginning , for example , in Chicago or on the East Coast .|Coast|sg|NNP|[u'shore.n.01']||PP|[]|['NNP']|False|[]|['to', 'Hawaii']|['West']|[u'flight', 'from']|NN|True|False|False|0|False|||would||0.170731707317|ZERO|THE
5195|THE|"data/parsed/22/wsj_2234.mrg|6|112"|As a practical matter , flights from the West Coast to Hawaii would be covered as they are under the time limit , but the language would exempt longer routes beginning , for example , in Chicago or on [ the East Coast . ]|Coast|sg|NNP|[u'shore.n.01']||PP|['.']|['NNP']|False|['.']|[]|['East']|['or', 'on']|NN|True|False|False|0|False|||would||0.975|ZERO|THE
5207|THE|"data/parsed/22/wsj_2234.mrg|8|18"|The measure is attached to [ the more than $ 26 billion fiscal 1990 transportation bill ] within Mr. Lautenberg 's jurisdiction , and the final compromise is laced with more than $ 205 million in road projects earmarked by members as well as funds sought by major airports , including Denver .|bill|sg|NN|[u'legal_document.n.01']||PP|[]|['JJR', 'IN', '$', 'CD', 'CD', 'JJ', 'CD', 'NN']|False|[]|['within', 'Mr.']|['more', 'than', '$', '<number>', 'billion', 'fiscal', '<number>', 'transportation']|[u'attach', 'to']|NN|False|False|False|0|False|||is|False|0.119047619048|ZERO|THE
5233|THE|"data/parsed/22/wsj_2234.mrg|11|87"|Majority Whip William Gray owes a political debt to Southern agriculture lawmakers for his rise in the House , and the Philadelphia Democrat used his position in the conference to salvage [ the exemption ] from a total ban .|exemption|sg|NN|[u'unsusceptibility.n.01']||NP|[]|[]|False|[]|['from']|[]|['to', 'salvage']|NN|False|True|False|5|False|PP|from|to|False|0.837837837838|ZERO|THE
5242|THE|"data/parsed/22/wsj_2234.mrg|12|79"|Although the smoking provision has attracted the most public interest , the underlying bill was the subject of behind-the-scenes lobbying because of its impact on air transportation and [ the more mundane , but politically important , projects ] of members .|project|pl|NN|[u'work.n.01']||NP|[]|['RBR', 'JJ', ',', 'CC', 'RB', 'JJ', ',']|True|[]|['of', u'member']|['more', 'mundane', ',', 'but', 'politically', 'important', ',']|['transportation', 'and']|NN|False|True|False|3|True|PP|of|was|True|0.875|ZERO|THE
5246|THE|"data/parsed/22/wsj_2234.mrg|13|26"|In a stark lesson in the power of [ the appropriations committees , ] the House deliberately killed a handful of projects backed by lawmakers in Florida , Illinois and Pennsylvania who had voted against the panel leadership on the House floor .|committee|pl|NN|[u'administrative_unit.n.01']||PP|[',']|['NNS']|False|[',']|['House']|[u'appropriation']|['power', 'of']|NN|False|False|False|0|False|||killed|False|0.210526315789|ZERO|THE
5261|THE|"data/parsed/22/wsj_2234.mrg|14|63"|`` Anybody can vote as they want , '' said Rep. William Lehman -LRB- D. , Fla. -RRB- , head of [ the House conferees . ]|conferee|pl|NN|[u'recipient.n.01']||PP|['.']|['NNP']|False|['.']|[]|['House']|['head', 'of']|NN|False|False|False|0|False||||False|0.954545454545|ZERO|THE
5279|THE|"data/parsed/22/wsj_2234.mrg|17|43"|The facilities account includes $ 40 million for Denver 's ambitious new airport , and [ the competition ] for these funds created shifting alliances between urban lawmakers representing established airports in Philadelphia and Michigan and the major carriers to Denver , United and Continental .|competition|sg|NN|[u'business_relation.n.01']||NP|[]|[]|False|[]|['for', 'these']|[]|[',', 'and']|NN|False|True|False|27|False|PP|for|includes|False|0.348837209302|ZERO|THE
5286|THE|"data/parsed/22/wsj_2234.mrg|17|99"|The facilities account includes $ 40 million for Denver 's ambitious new airport , and the competition for these funds created shifting alliances between urban lawmakers representing established airports in Philadelphia and Michigan and [ the major carriers ] to Denver , United and Continental .|carrier|pl|NN|[u'traveler.n.01']||NP|[]|['JJ']|False|[]|['to', 'Denver']|['major']|['Michigan', 'and']|NN|False|True|False|3|False|PP|to|includes|False|0.809523809524|ZERO|THE
5291|THE|"data/parsed/22/wsj_2234.mrg|18|11"|Leery of [ the costs -- ] and , critics say , competition -- the airlines have sought to gain leverage over the city of Denver .|cost|pl|NN|[u'reimbursement.n.01']||NP|[':']|[]|False|['--']|['and', ',']|[]|['Leery', 'of']|NN|False|True|False|1|False|CC|and|competition|False|0.0869565217391|ZERO|THE
5300|THE|"data/parsed/22/wsj_2234.mrg|19|48"|Texas Air Corp. , which owns Continental , and the Air Transport Association were prominent in [ the lobbying . ]|lobbying|sg|NN|||PP|['.']|[]|False|['.']|[]|[]|['prominent', 'in']|NN|False|False|False|0|False|||were|False|0.941176470588|ZERO|THE
5306|THE|"data/parsed/22/wsj_2234.mrg|20|58"|The industry sought to impose conditions that would have delayed funds for the project until Denver and [ the airlines ] had agreed to leases for 50 % of the gates .|airline|pl|NN|[u'hose.n.03']||NP|[]|[]|True|[]|[u'have', u'agree']|[]|['Denver', 'and']|NN|False|False|False|0|False|||had|True|0.586206896552|ZERO|THE
5309|THE|"data/parsed/22/wsj_2234.mrg|20|87"|The industry sought to impose conditions that would have delayed funds for the project until Denver and the airlines had agreed to leases for 50 % of [ the gates . ]|gate|pl|NN|[]||PP|['.']|[]|False|['.']|[]|[]|['%', 'of']|NN|False|False|False|0|False|||had|False|0.964285714286|ZERO|THE
5338|THE|"data/parsed/22/wsj_2234.mrg|25|12"|The impact of [ the changes ] is to eliminate many of the most excessive cases where the government has been paying more than $ 200 for each passenger in subsidies .|change|pl|NN|[u'happening.n.01']||PP|[]|[]|False|[]|[u'be', 'to']|[]|['impact', 'of']|NN|False|False|False|0|False|||is|False|0.103448275862|ZERO|THE
5408|THE|"data/parsed/22/wsj_2235.mrg|6|80"|The company said revenue rose 138 % , to $ 10.9 million from $ 4.6 million , reflecting the success of its movies `` Gorillas in [ the Mist '' ] and `` Rainman , '' as well as the box-office smash `` Batman .|Mist|sg|NN|[u'fog.n.01']||PP|"[""''""]"|[]|False|"[""''""]"|['and', '``']|[]|['Gorillas', 'in']|NN|False|False|False|0|False|||reflecting|False|0.634146341463|ZERO|THE
5410|THE|"data/parsed/22/wsj_2235.mrg|6|107"|The company said revenue rose 138 % , to $ 10.9 million from $ 4.6 million , reflecting the success of its movies `` Gorillas in the Mist '' and `` Rainman , '' as well as [ the box-office smash `` Batman . ]|Batman|sg|NNP|[u'attendant.n.01']||PP|['.']|['NN', 'NN', '``']|True|['.']|[]|['box-office', 'smash', '``']|['well', 'as']|NN|True|False|False|0|False|||reflecting||0.973684210526|ZERO|THE
5418|THE|"data/parsed/22/wsj_2236.mrg|1|72"|A group including Jon M. Huntsman of Salt Lake City , said it boosted its stake in Aristech Chemical Corp. to 8.36 % of [ the the common shares ] outstanding .|share|pl|NN|[u'assets.n.01']||NP|[]|['JJ']|False|[]|['outstanding', '.']|['common']|['%', 'of']|NN|False|True|False|2|False|ADJP|outstanding|boosted|False|0.888888888889|ZERO|THE
5459|THE|"data/parsed/22/wsj_2237.mrg|2|60"|Last month , the Senate voted to send a delegation of congressional staffers to Poland to assist its legislature , [ the Sejm , ] in democratic procedures .|Sejm|sg|NN|||NP|[',']|[]|False|[',']|['in', 'democratic']|[]|['legislature', ',']|NN|False|False|False|0|False|||to|False|0.8|ZERO|THE
5465|THE|"data/parsed/22/wsj_2237.mrg|4|3"|[ The Poles ] might do better to view it as a Trojan Horse .|Poles|pl|NNP|[u'rod.n.01']||S|[]|[]|False|[]|['might', 'do']|[]|[]|NN|True|False|False|0|False|||might||0.0|ZERO|THE
5474|THE|"data/parsed/22/wsj_2237.mrg|5|94"|It is the vast shadow government of 15,000 congressional staffers that helps create such legislative atrocities as the 1,376 page , 13-pound reconciliation bill that claimed to be the budget of [ the United States . ]|States|pl|NNP|[u'administrative_district.n.01']||PP|['.']|['NNP']|False|['.']|[]|['United']|['budget', 'of']|NN|True|False|False|0|False|||to||0.96875|ZERO|THE
5475|THE|"data/parsed/22/wsj_2237.mrg|6|10"|Maybe after [ the staffers ] explain their work to the Poles , they 'd be willing to come back and do the same for the American people .|staffer|pl|NN|[u'employee.n.01']||S|[]|[]|True|[]|['explain', 'their']|[]|['Maybe', 'after']|NN|False|False|False|0|False|||explain|True|0.0769230769231|ZERO|THE
5477|THE|"data/parsed/22/wsj_2237.mrg|6|26"|Maybe after the staffers explain their work to [ the Poles , ] they 'd be willing to come back and do the same for the American people .|Poles|pl|NNP|[u'rod.n.01']||PP|[',']|[]|True|[',']|"['they', ""'d""]"|[]|['work', 'to']|NN|True|False|False|0|False|||explain||0.32|ZERO|THE
5480|THE|"data/parsed/22/wsj_2237.mrg|6|69"|Maybe after the staffers explain their work to the Poles , they 'd be willing to come back and do the same for [ the American people . ]|people|pl|NN|[u'group.n.01']||PP|['.']|['JJ']|False|['.']|[]|['American']|['same', 'for']|NN|False|False|False|0|False|||to|False|0.958333333333|ZERO|THE
5490|THE|"data/parsed/22/wsj_2238.mrg|2|4"|[ The results ] for the half were worse than market expectations , which suggested an interim loss of around 10 million Irish punts .|result|pl|NN|[u'phenomenon.n.01']||NP|[]|[]|False|[]|['for']|[]|[]|NN|False|True|False|3|False|PP|for|were|False|0.0|ZERO|THE
5491|THE|"data/parsed/22/wsj_2238.mrg|2|12"|The results for [ the half ] were worse than market expectations , which suggested an interim loss of around 10 million Irish punts .|half|sg|NN|[u'common_fraction.n.01']||PP|[]|[]|False|[]|[u'be', u'bad']|[]|[u'result', 'for']|NN|False|False|False|0|False|||were|False|0.136363636364|ZERO|THE
5567|THE|"data/parsed/22/wsj_2239.mrg|9|9"|Contributing to [ the selling pressure ] were dispatches by several investment firms advising clients to boost their stock holdings and reduce the size of their cash or bond portfolios .|pressure|sg|NN|[u'physical_phenomenon.n.01']||PP|[]|['NN']|False|[]|[u'be', u'dispatch']|['selling']|['Contributing', 'to']|NN|False|False|False|0|False||||False|0.0740740740741|ZERO|THE
5658|THE|"data/parsed/22/wsj_2239.mrg|26|50"|`` I think the willingness of securities companies to make markets for high-yield issues improved [ the sentiment ] for junk bonds , '' said John Lonski , an economist at Moody 's Investors Service Inc .|sentiment|sg|NN|[u'feeling.n.01']||NP|[]|[]|False|[]|['for', 'junk']|[]|[u'issue', u'improve']|NN|False|True|False|5|False|PP|for|improved|False|0.441176470588|ZERO|THE
5745|THE|"data/parsed/22/wsj_2239.mrg|42|46"|Meanwhile , agency supply is expected to weigh heavily on the market today when [ the Federal Home Loan Bank ] prices a $ 2.3 billion offering of one-year , three-year , five-year and 10-year maturities .|Bank|sg|NNP|[u'slope.n.01']||S|[]|['NNP', 'NNP', 'NNP']|False|[]|[u'price']|['Federal', 'Home', 'Loan']|['today', 'when']|NN|True|False|False|0|False|||prices||0.451612903226|ZERO|THE
5749|THE|"data/parsed/22/wsj_2239.mrg|43|8"|Tomorrow , [ the Resolution Funding Corp. ] will provide details of its first bond issue , which is expected to total between $ 4 billion and $ 6 billion and carry a maturity greater than 20 years .|Corp.|sg|NNP|||S|[]|['NNP', 'NNP']|False|[]|['will', 'provide']|['Resolution', 'Funding']|['Tomorrow', ',']|NN|True|False|False|0|False|||will||0.0588235294118|ZERO|THE
5762|THE|"data/parsed/22/wsj_2239.mrg|45|10"|And this week [ the Tennessee Valley Authority ] plans to price a $ 3 billion offering , its first public debt borrowing in 15 years .|Authority|sg|NNP|[u'control.n.01']||S|[]|['NNP', 'NNP']|False|[]|[u'plan', 'to']|['Tennessee', 'Valley']|['this', 'week']|NN|True|False|False|0|False|||plans||0.136363636364|ZERO|THE
5819|THE|"data/parsed/22/wsj_2239.mrg|58|17"|Thus , higher bidding narrows [ the investor 's ] return while lower bidding widens it .|investor|sg|NN|[u'capitalist.n.02']||NPB|['POS']|[]|False|"[""'s""]"|['return', 'while']|[]|['bidding', u'narrow']|NN|False|False|False|0|False|||narrows|False|0.384615384615|ZERO|THE
5822|THE|"data/parsed/22/wsj_2239.mrg|59|3"|[ The percentage rates ] are calculated on a 360-day year , while the coupon-equivalent yield is based on a 365-day year .|rate|pl|NN|[u'tax.n.01']||S|[]|['NN']|True|[]|[u'be', u'calculate']|['percentage']|[]|NN|False|False|False|0|False|||are|True|0.0|ZERO|THE
5828|THE|"data/parsed/22/wsj_2239.mrg|61|4"|[ The 13-week bills ] mature Jan. 18 , 1990 , and the 26-week bills mature April 19 , 1990 .|bill|pl|NN|[u'legal_document.n.01']||S|[]|['JJ']|False|[]|['mature', 'Jan.']|['13-week']|[]|NN|False|False|False|0|False|||mature|False|0.0|ZERO|THE
5830|THE|"data/parsed/22/wsj_2239.mrg|61|28"|The 13-week bills mature Jan. 18 , 1990 , and [ the 26-week bills ] mature April 19 , 1990 .|bill|pl|NN|[u'legal_document.n.01']||S|[]|['JJ']|False|[]|['mature', 'April']|['26-week']|[',', 'and']|NN|False|False|False|0|False|||mature|True|0.588235294118|ZERO|THE
5862|THE|"data/parsed/22/wsj_2239.mrg|70|68"|-- Britain 's 11 3\\/4 % bond due 2003\\/2007 ended 1 1\\/8 higher at 111 19\\/32 to yield 10.12 % , while [ the 11 3\\/4 % notes ] due 1991 rose 21\\/32 to 98 26\\/32 to yield 12.74 % .|note|pl|NN|[u'written_record.n.01']||NP|[]|['CD', 'CD', 'NN']|False|[]|['due', '<number>']|['<number>', '3\\\\/4', '%']|[',', 'while']|NN|False|True|False|2|False|ADJP|due|rose|False|0.628571428571|ZERO|THE
5884|THE|"data/parsed/22/wsj_2239.mrg|73|95"|Dealers said morning activity was hectic as prices dropped in response to gains in the stock market and losses in Treasury securities , but trading slowed to moderate levels in [ the afternoon . ]|afternoon|sg|NN|[u'day.n.04']||PP|['.']|[]|False|['.']|[]|[]|[u'level', 'in']|NN|False|False|False|0|False|||slowed|False|0.967741935484|ZERO|THE
5921|THE|"data/parsed/22/wsj_2239.mrg|79|6"|Offsetting [ the Remic-related purchases ] were continued heavy sales by mortgage originators , which are producing increased amounts of fixed-rate mortgage-backed issues with lower rates .|purchase|pl|NN|[u'acquisition.n.01']||VP|[]|['JJ']|False|[]|[u'be', u'continue']|['Remic-related']|['Offsetting']|NN|False|False|False|0|False||||False|0.0434782608696|ZERO|THE
5936|THE|"data/parsed/22/wsj_2239.mrg|83|3"|[ The session losses ] left municipal dollar bonds close to where they were before the 190.58-point drop in the Dow Jones Industrial Average Friday prompted a capital markets rally .|loss|pl|NN|[u'financial_loss.n.01']||S|[]|['NN']|False|[]|[u'leave', 'municipal']|['session']|[]|NN|False|False|False|0|False|||left|False|0.0|ZERO|THE
